"Title (English Translation)","Organization (English Translation)","Organization Sub Department (English Translation)","Tender Value","Published Date","Inquiry Deadline","Days Left to Send Inquiries","Bid Deadline Date and Time","Days left Until Bid Closing","Keyword (English Translation)","Detail Url","Title (Arabic)","keywords"
"Supply and installation of the Smart Research Center for Smart and Cyber ​​Systems at the University of Bisha","Bisha University","Contracts and procurement management","800","2025-11-17","2025-11-27",10,"2025-12-03 @ 09:59",16,"tasty","https://tenders.etimad.sa/Tender/DetailsForVisitor?STenderId=9%20I4S7%20LskRPYhSXBImA2A==","توريد وتركيب مركز الأبحاث الذكية للأنظمة الذكية و السيبرانية بجامعة بيشة","ذكي"
"Supplying smart phones to the Deanship of Student Affairs at the University of Tabuk","University of Tabuk","Contracts and procurement management","1000","2025-11-16","2025-11-26",9,"2025-12-02 @ 09:59",15,"tasty","https://tenders.etimad.sa/Tender/DetailsForVisitor?STenderId=FYcN3A2Z2UpYshCAXrOJlw==","توريد اجهزة هاتف ذكية لعمادة شؤون الطلاب في جامعة تبوك","ذكي"
"A solar system project integrated with a DC pump to operate irrigation systems","Saudi Water Authority","Purchasing Department - Services and Projects Purchasing Department","1000","2025-11-13","2025-11-23",6,"2025-11-29 @ 10:00",12,"tasty","https://tenders.etimad.sa/Tender/DetailsForVisitor?STenderId=hj2U3XyeAuOcJUp4ks%20Ebw==","مشروع نظام شمسي مدمج بمضخة تيار مستمر لتشغيل أنظمة الري","ذكي"
"Preparing a smart framework for developing tools, training solutions, and competencies for the water sector","Saudi Water Authority","Purchasing Department - Services and Projects Purchasing Department","1000","2025-11-13","2025-11-28",11,"2025-12-14 @ 09:59",27,"tasty","https://tenders.etimad.sa/Tender/DetailsForVisitor?STenderId=VDJ2ra5l%20BxhRBME68c6eQ==","اعداد إطار ذكي لتطوير الأدوات والحلول التدريبية والجدارات لقطاع المياه","ذكي"
"A project to rehabilitate and develop smart pedestrian crossing corridors to raise the efficiency of traffic safety in the city of Sakaka","Al-Jawf Region Municipality","Managing tenders and procurement in Al-Jouf Municipality","1000","2025-11-10","2025-11-20",3,"2025-11-26 @ 09:59",9,"passage","https://tenders.etimad.sa/Tender/DetailsForVisitor?STenderId=GBxhEVWJ4l2pKagTmZqZbA==","مشروع تأهيل وتطوير ممرات عبور مشاة ذكية لرفع كفاءة السلامة المرورية بمدينة سكاكا","مرور"
"Supporting appeals courts with smart interconnect devices (SD-WAN)","Ministry of Justice","General Office - Purchasing and Contracts Department","1000","2025-11-06","2025-11-16",-1,"2025-11-22 @ 09:59",5,"tasty","https://tenders.etimad.sa/Tender/DetailsForVisitor?STenderId=WHJd49XF8a8%20*@@**raQZ9njDw==","دعم محاكم الاستئناف بأجهزة الربط الذكية (SD-WAN)","ذكي"
"Preparing the technical infrastructure for the new building of the General Real Estate Authority","General Authority for Real Estate","Procurement and contracts","5500","2025-11-06","2025-11-16",-1,"2025-12-07 @ 09:59",20,"tasty","https://tenders.etimad.sa/Tender/DetailsForVisitor?STenderId=vrG62*@@**bJ*@@**G*@@**D5zd7y5KEAA==","تجهيز البنية التقنية للمبنى الجديد للهيئة العامة للعقار","ذكي"
"Attendance and departure program for employees","Saudi Food and Drug Authority","Contracts and procurement management","800","2025-11-06","2025-11-12",-5,"2025-11-23 @ 09:59",6,"tasty","https://tenders.etimad.sa/Tender/DetailsForVisitor?STenderId=Y7VJWIW3fxACBFhCxFZ1kg==","برنامج الحضور والانصراف للموظفين","ذكي"
"Supporting and developing the Authority’s websites and the Live It 2025 platform","General Entertainment Authority","Purchasing Department - Entertainment Authority","5500","2025-11-03","2025-11-18",1,"2025-12-04 @ 09:59",17,"platform","https://tenders.etimad.sa/Tender/DetailsForVisitor?STenderId=lniVUogRvnyFOHXSRoiNeA==","دعم وتطوير مواقع الهيئة ومنصة عيشها 2025","منصة"
"Linking the international police “Interpol” with the security sectors","Ministry of Interior","General Office - Department of Competitions and Contracts","1500","2025-10-27","2025-11-19",2,"2025-12-04 @ 10:00",17,"passage","https://tenders.etimad.sa/Tender/DetailsForVisitor?STenderId=L2q5Mz9twpo7ePDGCV0j2g==","ربط الشرطة الدولية ""الإنتربول"" مع القطاعات الأمنية","مرور"
"Beneficiary service operation and communication efficiency project at the Digital Transformation and Smart Cities Agency","Eastern Province Secretariat","Purchasing management for public competitions for the Eastern Province Secretariat","3500","2025-10-23","2025-11-17",0,"2025-11-23 @ 10:00",6,"tasty","https://tenders.etimad.sa/Tender/DetailsForVisitor?STenderId=ILMqlxaDUgX0KvG7rUnt0g==","مشروع تشغيل خدمة المستفيدين وكفاءة الاتصال بوكالة التحول الرقمي والمدن الذكية","ذكي"
"Operating and maintaining the Intelligent Operations Center (IOC), its affiliated systems, and the smart columns at the Royal Commission","General Administration of Yanbu Project","Yanbu Industrial City - Contracts Administration - Contracts Section","700","2025-10-23","2025-11-13",-4,"2025-11-25 @ 12:30",8,"tasty","https://tenders.etimad.sa/Tender/DetailsForVisitor?STenderId=fJ*@@**c3FZ75b1iN*@@**49iTlRDw==","تشغيل وصيانة مركز العمليات الذكي IOC والأنظمة التابعة لها والاعمدة الذكية في الهيئة الملكية","ذكي"
"Digital innovation project in digital exhibitions","Royal ceremonies","Procurement and tenders","1000","2025-10-15","2025-11-13",-4,"2025-11-19 @ 09:00",2,"tasty","https://tenders.etimad.sa/Tender/DetailsForVisitor?STenderId=KTARyo1dD5te0wB0D2AMsg==","مشروع الإبتكار الرقمي في المعارض الرقمية","ذكي"
"A project to operate the project office services at the Digital Transformation and Smart Cities Agency","Eastern Province Secretariat","Purchasing management for public competitions for the Eastern Province Secretariat","5500","2025-09-28","2025-11-09",-8,"2025-11-19 @ 20:00",2,"tasty","https://tenders.etimad.sa/Tender/DetailsForVisitor?STenderId=ydZI*@@**nQJeVnqY86lR5k%20KA==","مشروع تشغيل خدمات مكتب المشاريع بوكالة التحول الرقمي والمدن الذكية","ذكي"
"Call center, third stage","Ministry of Foreign Affairs","General Office - Purchases","1000","2025-09-09","2025-11-12",-5,"2025-11-25 @ 13:00",8,"Intelligence","https://tenders.etimad.sa/Tender/DetailsForVisitor?STenderId=%20CX2vGHpJZCCB0d2vB96KQ==","مركز الاتصال المرحلة الثالثة","الذكاء"
"Improving and upgrading the institutional systems of the Ministry of Tourism","Ministry of Tourism","General Administration of Purchases and Contracts","1000","2025-11-17","2025-11-25",8,"2025-12-18 @ 09:59",31,"Intelligence","https://tenders.etimad.sa/Tender/DetailsForVisitor?STenderId=qe2vsgeeEhKwqHNtzEJEXw==","تحسين وترقية الأنظمة المؤسسية لوزارة السياحة","الذكاء"
"Obtaining a license to contract with a service provider to provide an integrated platform for evaluating job candidates through...","King Saud bin Abdulaziz University for Health Sciences","Direct Purchasing Department at King Saud University for Health Sciences","200","2025-11-13","2025-11-16",-1,"2025-11-20 @ 09:59",3,"platform","https://tenders.etimad.sa/Tender/DetailsForVisitor?STenderId=fHIDI5BC0ScR9XHI4ABrMg==","الحصول على رخصة التعاقد مع مزود خدمة لتقديم منصة متكاملة لتقييم المرشحين للوظائف من خلال اختبارات ال ...","منصة"
"Operating and renewing operators portal licenses 2","Saudi Data and Artificial Intelligence Authority","Saudi Data and Artificial Intelligence Authority","1000","2025-11-11","2025-12-08",21,"2025-12-12 @ 09:59",25,"Intelligence","https://tenders.etimad.sa/Tender/DetailsForVisitor?STenderId=45Xd3zecoYwX6U*@@**8pCFcZg==","تشغيل و تجديد رخص بوابة المشغلين 2","الذكاء"
"Project for managing and developing educational hall systems at Princess Noura bint Abdul Rahman University, second phase","Princess Noura bint Abdul Rahman University","Public procurement","1000","2025-11-11","2025-11-21",4,"2025-12-12 @ 09:59",25,"Intelligence","https://tenders.etimad.sa/Tender/DetailsForVisitor?STenderId=mGaRPTA3XLitwnRefBmshg==","مشروع ادارة وتطوير انظمة القاعات التعليمية بجامعة الاميرة نورة بنت عبدالرحمن المرحلة الثانية","الذكاء"
"Competition for a project to provide a service for archiving and digitizing the Authority’s documents","Saudi Electricity Regulatory Authority","Purchasing and contracts management","500","2025-11-10","2025-11-20",3,"2025-11-26 @ 09:59",9,"Intelligence","https://tenders.etimad.sa/Tender/DetailsForVisitor?STenderId=DbWZFZPC0AV38EkOwKBCgA==","منافسة مشروع تقديم خدمة أرشفة ورقمنة وثائق الهيئة","الذكاء"
"Data and artificial intelligence strategy","Insurance Authority","Purchases","1000","2025-11-06","2025-11-16",-1,"2025-11-22 @ 09:59",5,"Intelligence","https://tenders.etimad.sa/Tender/DetailsForVisitor?STenderId=HBDL29srPkrF0zEH5oyGpA==","أستراتيجية البيانات والذكاء الاصطناعي","الذكاء"
"Preparing and supplying technical requirements for secure visual communication (Brouk)","National Health Insurance Center","National Health Insurance Center","1000","2025-10-29","2025-11-17",0,"2025-11-19 @ 10:00",2,"platform","https://tenders.etimad.sa/Tender/DetailsForVisitor?STenderId=di7WzaBQyFYkXuwaVLh1FA==","اعداد وتوريد المتطلبات التقنية للاتصال المرئي الآمن (بروق)","منصة"
"Renewing, providing and installing licenses supporting data management and governance tools","Saudi Standards, Metrology and Quality Organization","Managing competitions and contracts","1500","2025-10-29","2025-11-05",-12,"2025-11-18 @ 09:59",1,"Intelligence","https://tenders.etimad.sa/Tender/DetailsForVisitor?STenderId=Dzs25p32FeWrDf4itArC1w==","تجديد وتوفير وتركيب الرخص الداعمة لأدوات إدارة وحوكمة البيانات","الذكاء"
"Expansion and renovation of storage systems - the third phase","Saudi Data and Artificial Intelligence Authority","Saudi Data and Artificial Intelligence Authority","1000","2025-10-20","2025-11-16",-1,"2025-11-20 @ 09:59",3,"Intelligence","https://tenders.etimad.sa/Tender/DetailsForVisitor?STenderId=0BZLROSu3uD13ovcZQ8NpQ==","توسعة وتجديد أنظمة التخزين - المرحلة الثالثة","الذكاء"
"Text messaging and digital connectivity project with service providers - second phase","Saudi Data and Artificial Intelligence Authority","Saudi Data and Artificial Intelligence Authority","1000","2025-10-19","2025-11-15",-2,"2025-11-20 @ 10:00",3,"Intelligence","https://tenders.etimad.sa/Tender/DetailsForVisitor?STenderId=8SIfIleQW0Xa51gnN*@@**zEvg==","مشروع الرسائل النصية والربط الرقمي مع مزودي الخدمة - المرحلة الثانية","الذكاء"
"Artificial intelligence applications and emerging technologies in the waste sector","National Center for Waste Management","National Center for Waste Management","1000","2025-10-16","2025-11-11",-6,"2025-11-19 @ 10:00",2,"Intelligence","https://tenders.etimad.sa/Tender/DetailsForVisitor?STenderId=MnUBfv7s4HN2QcWHHmdexw==","تطبيقات الذكاء الاصطناعي والتقنيات الناشئة في قطاع النفايات","الذكاء"
"Increasing traffic safety efficiency in Al Majmaah","Riyadh Municipality","Municipality of Al Majma'ah Governorate","1000","2025-11-13","2025-11-27",10,"2025-11-29 @ 09:59",12,"passage","https://tenders.etimad.sa/Tender/DetailsForVisitor?STenderId=EgEHeT2wZNvrGIgsqTQPXw==","رفع كفاءة السلامة المرورية بالمجمعة","مرور"
"Supplying traffic equipment for engineering and works administration branches","Strategic Missile Force","Engineering management and works","700","2025-11-13","2025-11-23",6,"2025-12-01 @ 09:59",14,"passage","https://tenders.etimad.sa/Tender/DetailsForVisitor?STenderId=BeufrB7CFNDLUHnffCJq3A==","توريد تجهيزات مرورية لأفرع الإدارة الهندسية والاشغال","مرور"
"Supply and installation of metal barriers for drains on agricultural roads for a number of sites affiliated with the General Irrigation Corporation in the Governorate of...","General Corporation for Irrigation","Al-Ahsa Branch","1500","2025-11-05","2025-11-15",-2,"2025-11-21 @ 09:59",4,"passage","https://tenders.etimad.sa/Tender/DetailsForVisitor?STenderId=aY*@@**fzIXXSZ*@@**HntOg5z9kXA==","توريد وتركيب حواجز معدنية للمصارف بالطرق الزراعية لعدد من المواقع التابعة للمؤسسة العامة للري بمحافظ ...","مرور"
"An announcement in a newspaper about the sale of impounded vehicles at the Eastern Province Traffic Department (Khafji)","Public Security (General Traffic Department)","General Traffic Department","200","2025-11-16","2025-11-20",3,"2025-11-22 @ 09:59",5,"passage","https://tenders.etimad.sa/Tender/DetailsForVisitor?STenderId=FHB4%208%20PEeyuzLciws36MQ==","إعلان في صحيفة عن بيع مركبات محجوزة بإدارة مرور منطقة الشرقية (الخفجي)","مرور"
"Repair, maintenance and painting of iron barriers belonging to the Hail Region Traffic Department","Public Security (General Traffic Department)","General Traffic Department","200","2025-11-11","2025-11-15",-2,"2025-11-17 @ 09:59",0,"passage","https://tenders.etimad.sa/Tender/DetailsForVisitor?STenderId=R1fd7P7e%20j5zKV1z8%20Bo7w==","اصلاح وصيانة ودهان حواجز حديدية تابعة لإدارة مرور منطقة حائل","مرور"
"Providing sewage network cleaning services at Prince Mohammed bin Abdulaziz Hospital and the Primary Health Care Center in...","Health Affairs at the Ministry of National Guard","Tenders for Prince Muhammad bin Abdulaziz Hospital in Medina","700","2025-11-10","2025-11-24",7,"2025-12-07 @ 10:00",20,"passage","https://tenders.etimad.sa/Tender/DetailsForVisitor?STenderId=k*@@**J7TWQKm4fnv2aeTMO1mg==","تقديم خدمة تنظيف شبكات الصرف الصحي بمستشفى الأمير محمد بن عبدالعزيز ومركز الرعاية الصحية الأولية بال ...","مرور"
"Testing and operating an experimental station to study the effect of sterilizers on pipes made of high-quality polyethylene...","Saudi Water Authority","Purchasing Department - Services and Projects Purchasing Department","1000","2025-09-01","2025-11-16",-1,"2025-11-20 @ 10:00",3,"passage","https://tenders.etimad.sa/Tender/DetailsForVisitor?STenderId=33mopdlI152oDpJwplBXsw==","اختبار وتشغيل محطة تجريبية لدراسة أثر المعقمات على الانابيب المصنعة من مادة البولي ايثيلين عالي ال ...","مرور"
"Competition to provide modern servers for the Najran Health Cluster’s care model platform","Najran Health Complex","Contracts and procurement management","600","2025-11-17","2025-11-27",10,"2025-12-03 @ 09:59",16,"platform","https://tenders.etimad.sa/Tender/DetailsForVisitor?STenderId=sDSy7DMhp%20fxqSLd*@@**VZ1NA==","منافسة توفير سيرفرات حديثة لمنصة نموذج الرعاية بتجمع نجران الصحي","منصة"
"Renewal of backup and data storage licenses for the year 2026","King Abdulaziz Reserve","King Abdulaziz Reserve","1000","2025-11-17","2025-11-27",10,"2025-12-03 @ 09:59",16,"platform","https://tenders.etimad.sa/Tender/DetailsForVisitor?STenderId=ys55XN*@@**wnDFLebv24FFTvw==","تجديد رخص النسخ الاحتياطي وحفظ البيانات لعام 2026","منصة"
"Preparing the ceremony platform at the Prison Training Institute (25/26)","General Directorate of Prisons","General Administration of Competitions and Procurement","200","2025-11-13","2025-11-16",-1,"2025-11-19 @ 09:59",2,"platform","https://tenders.etimad.sa/Tender/DetailsForVisitor?STenderId=VyoHeSEcPq7GqVmPnVEklw==","تجهيز منصة الحفل بمعهد تدريب السجون (25/26)","منصة"
"Developing the first phase of the digital diplomatic center","Ministry of Foreign Affairs","General Office - Purchases","1000","2025-11-13","2025-11-23",6,"2025-11-29 @ 09:59",12,"platform","https://tenders.etimad.sa/Tender/DetailsForVisitor?STenderId=6xiFOEos89r8b%20W2AQCR1w==","تطوير المرحلة الأولى من المركز الدبلوماسي الرقمي","منصة"
"A project to produce 140 electronic training products","Institute of Public Administration","Purchasing management","3500","2025-11-12","2025-11-27",10,"2025-12-14 @ 10:20",27,"platform","https://tenders.etimad.sa/Tender/DetailsForVisitor?STenderId=qf8RR*@@**aOPtzEEEow2mNFKw==","مشروع إنتاج 140 منتج تدريبي إلكتروني","منصة"
"Technical periodic operation and process governance","Saudi Water Authority","Purchasing Department - Services and Projects Purchasing Department","1000","2025-11-12","2025-11-22",5,"2025-11-30 @ 10:00",13,"platform","https://tenders.etimad.sa/Tender/DetailsForVisitor?STenderId=FuVWz3F6MD*@@**rrhUfe94YGQ==","التشغيل الدوري التقني وحوكمة العمليات","منصة"
"Providing professional services for maintenance, operation and development of the Ithrai platform","Institute of Public Administration","Purchasing management","3500","2025-11-11","2025-11-21",4,"2025-12-15 @ 10:20",28,"platform","https://tenders.etimad.sa/Tender/DetailsForVisitor?STenderId=YWziURyK0r8SBVFXp*@@**hXCg==","تقديم خدمات احترافية لصيانة وتشغيل وتطوير منصة إثرائي","منصة"
"Subscribe to the SciVal platform to support research performance and global rankings","Imam Muhammad bin Saud University","General Administration of Purchases and Competitions","1000","2025-11-11","2025-11-21",4,"2025-11-30 @ 09:59",13,"platform","https://tenders.etimad.sa/Tender/DetailsForVisitor?STenderId=Rye71IyPI0UT*@@**gu%20RDQcgg==","الاشتراك في منصة SciVal لدعم الأداء البحثي والتصنيفات العالمية","منصة"
"Subscribe to a platform for specialized foreign language research databases","Education Evaluation Commission","General Administration of Purchases and Contracts","1000","2025-11-10","2025-11-15",-2,"2025-11-26 @ 09:59",9,"platform","https://tenders.etimad.sa/Tender/DetailsForVisitor?STenderId=fUD0EXPjgitf0oKb60n*@@**NQ==","الاشتراك في منصة لقواعد المعلومات البحثية باللغة الأجنبية المتخصصة","منصة"
"Operation of the 2025 government press conference phase two","Ministry of Information","General Office - Purchasing Department","1000","2025-11-06","2025-11-16",-1,"2025-11-22 @ 09:59",5,"platform","https://tenders.etimad.sa/Tender/DetailsForVisitor?STenderId=vdvQd*@@**zhat3vm%20ky*@@**criUw==","تشغيل المؤتمر الصحفي الحكومي لعام 2025 المرحلة الثانية","منصة"
"Operating and supporting the current electronic platform of the Judicial Training Center","Ministry of Justice","General Office - Purchasing and Contracts Department","1000","2025-11-05","2025-11-22",5,"2025-12-06 @ 09:59",19,"platform","https://tenders.etimad.sa/Tender/DetailsForVisitor?STenderId=CdvqUTIqUoK8UV0JLj2Xaw==","تشغيل ودعم المنصة الإلكترونية الحالية لمركز التدريب العدلي","منصة"
"National Title Campaign","Saudi Post Corporation","General Administration of Supply Chains","1000","2025-11-05","2025-11-15",-2,"2025-11-21 @ 09:59",4,"platform","https://tenders.etimad.sa/Tender/DetailsForVisitor?STenderId=biiq5T75SFpnlVKnAeLgYQ==","الحملة الوطنية للعنوان الوطني","منصة"
"Providing and installing secure communication requirements (Brouk platform) at the General Ports Authority","General Authority of Ports","Purchasing and contracts management","800","2025-11-04","2025-11-24",7,"2025-12-14 @ 09:00",27,"platform","https://tenders.etimad.sa/Tender/DetailsForVisitor?STenderId=krTXcaJV0VQoF*@@**lQAPvgIA==","توفير وتركيب متطلبات الاتصال الآمن (منصة بروق) بالهيئة العامة للموانئ","منصة"
"The need to wash items designated for the region’s hospitality and approval to put them on the platform approving the limits of direct purchasing powers.","Border guards","Border Guard Command in Tabuk region","200","2025-11-02","2025-11-12",-5,"2025-11-18 @ 09:59",1,"platform","https://tenders.etimad.sa/Tender/DetailsForVisitor?STenderId=R1uFKHt1urZJhW3vhEHYOg==","الحاجة لغسيل أصناف مخصصة لضيافة المنطقة والموافقة لطرحها بمنصة اعتماد حدود صلاحيات الشراء المباشر .","منصة"
"Renewing licenses for the center’s data management and governance platform","National Center for Waste Management","National Center for Waste Management","1000","2025-10-30","2025-11-17",0,"2025-11-23 @ 10:00",6,"platform","https://tenders.etimad.sa/Tender/DetailsForVisitor?STenderId=FYiDyzQAd2pBS9RoIEz39w==","تجديد رخص منصة إدارة وحوكمة البيانات للمركز","منصة"
"Renewed support on standby environment servers for the litigation platform","Ministry of Justice","General Office - Purchasing and Contracts Department","1000","2025-10-30","2025-11-09",-8,"2025-11-30 @ 09:59",13,"platform","https://tenders.etimad.sa/Tender/DetailsForVisitor?STenderId=Dd6wUF6xvJCbFruFQFBVlA==","تجديد الدعم على خوادم البيئة الاحتياطية لمنصة تقاضي","منصة"
"Financial and analytical data platform subscription project","National Infrastructure Fund","National Infrastructure Fund","500","2025-10-29","2025-11-17",0,"2025-11-20 @ 12:00",3,"platform","https://tenders.etimad.sa/Tender/DetailsForVisitor?STenderId=7COUP*@@**WUvAsJmCS6unjdGw==","مشروع اشتراك منصة البيانات المالية والتحليلية","منصة"
"Renewal of the backup system at the National Center for Sustainable Agriculture Research and Development (Estidama)","National Center for Sustainable Agriculture Research and Development","National Center for Sustainable Agriculture Research and Development","2000","2025-10-28","2025-11-19",2,"2025-11-20 @ 13:00",3,"platform","https://tenders.etimad.sa/Tender/DetailsForVisitor?STenderId=j0xhuZf2mQx3vJPh0RZO0g==","تجديد نظام النسخ الاحتياطي بالمركز الوطني لأبحاث وتطوير الزراعة المستدامة (استدامة)","منصة"
"Developing and providing technical support to the national communication platform in cases of nuclear and radiation reports","Nuclear and Radiological Regulatory Authority","Nuclear and Radiological Regulatory Authority","5500","2025-10-28","2025-11-13",-4,"2025-11-27 @ 10:00",10,"platform","https://tenders.etimad.sa/Tender/DetailsForVisitor?STenderId=Zu1rrt8u*@@**LQRKvt03kzQOA==","تطوير و تقديم الدعم الفني للمنصة الوطنية للتواصل في حالات البلاغات النووية والإشعاعية","منصة"
"Subscription to S&P, IHS Markit or equivalent platforms","Saudi Export-Import Bank","Saudi Export-Import Bank (Purchasing and Contracts Department)","500","2025-10-23","2025-11-14",-3,"2025-11-20 @ 10:00",3,"platform","https://tenders.etimad.sa/Tender/DetailsForVisitor?STenderId=tDx12HXB9J90EBo2xc5kgw==","اشتراك في منصتي S&P و IHS Markit أو ما يعادلها","منصة"
"Operating, maintaining and developing the training and e-learning platform at the Ministry of Health, the second phase","Ministry of Health General Office","Office of the Ministry, General Administration of Contracts and Procurement","1000","2025-10-21","2025-11-09",-8,"2025-11-20 @ 09:00",3,"platform","https://tenders.etimad.sa/Tender/DetailsForVisitor?STenderId=x05*@@**1NmdoJEuBum4oiT%20XA==","تشغيل وصيانة وتطوير منصة التدريب والتعليم الالكتروني بوزارة الصحة المرحلة الثانية","منصة"
"A project to provide and operate the digital system for managing student clubs at King Saud University","King Saud University","General Administration of Purchases","1500","2025-10-21","2025-11-27",10,"2025-12-03 @ 15:00",16,"platform","https://tenders.etimad.sa/Tender/DetailsForVisitor?STenderId=On%20t68zSCH7hy%201Z4PLVxQ==","مشروع توفير وتشغيل النظام الرقمي لإدارة الأندية الطلابية بجامعة الملك سعود","منصة"
"Strategy and project management platform","King Saud University","General Administration of Purchases","1500","2025-10-21","2025-11-20",3,"2025-11-24 @ 15:00",7,"platform","https://tenders.etimad.sa/Tender/DetailsForVisitor?STenderId=dbyFhmeBmp9rPivctsJSSw==","منصة إدارة الاستراتيجية والمشاريع","منصة"
