"Implementing and developing an electronic collection system and a unified platform for notifications","Agricultural Development Fund","Purchasing and contracts management","1500","2025-10-20","2025-11-17",0,"2025-11-19 @ 10:00",2,"platform","https://tenders.etimad.sa/Tender/DetailsForVisitor?STenderId=1J%20wTlC3NSf*@@**Cz%20V*@@**h4aPA==","تنفيذ وتطوير نظام تحصيل الكتروني ومنصة موحدة للإشعارات","منصة"
"Improving and developing 4 bathrooms in the Western Fleet Command Building at King Faisal Naval Base in Jeddah","Navy","Operation and maintenance center at King Faisal Naval Base in Jeddah","200","2025-11-06","2025-11-16",-1,"2025-11-22 @ 09:59",5,"fleet","https://tenders.etimad.sa/Tender/DetailsForVisitor?STenderId=GNu5fdRIsRARJnXSZD05vA==","تحسين وتطوير عدد 4 دورات مياة بمبنى قيادة الاسطول الغربي بقاعدة الملك فيصل البحرية بجدة","اسطول"
"Maintenance of lighting roads and neighborhoods in Al-Bukayriyah Governorate and its affiliated centers","Al-Bukayriyah Governorate Municipality","Al-Bukayriyah Municipality","5500","2025-11-17","2025-11-27",10,"2025-12-03 @ 09:59",16,"lighting","https://tenders.etimad.sa/Tender/DetailsForVisitor?STenderId=fE66YRY2Npp1Vf8Vr8H7Jw==","صيانة انارة طرق واحياء محافظة البكيرية والمراكز التابعة لها","انارة"
"Supplying concrete bases and nails for lighting and decorative poles","Umluj Governorate Municipality","Umluj Governorate Municipality","550","2025-11-05","2025-11-19",2,"2025-11-21 @ 09:59",4,"lighting","https://tenders.etimad.sa/Tender/DetailsForVisitor?STenderId=s7*@@**Wl5ae4gTvIM6b2Pna%20A==","توريد قواعد خرسانية ومسامير للأ عمدة الانارة والديكورية","انارة"
"Maintenance and rehabilitation of lighting on bridges, squares and central islands west of Arar","Northern Border Region Secretariat","Purchasing Department - Secretariat","1000","2025-11-03","2025-11-16",-1,"2025-11-20 @ 09:59",3,"lighting","https://tenders.etimad.sa/Tender/DetailsForVisitor?STenderId=rBUliF2I9vmqkYyHtP*@@**y%20Q==","صيانة واعادة تاهيل انارة الجسور والميادين والجزر الوسطية غرب عرعر","انارة"
"Maintenance and rehabilitation of lighting on bridges, squares and central islands east of Arar","Northern Border Region Secretariat","Purchasing Department - Secretariat","1000","2025-11-03","2025-11-19",2,"2025-11-22 @ 09:59",5,"lighting","https://tenders.etimad.sa/Tender/DetailsForVisitor?STenderId=BAJIu%20QQFcsWp1Bs6ydD8g==","صيانة واعادة تاهيل انارة الجسور والميادين والجزر الوسطية شرق عرعر","انارة"
"Rehabilitation of lighting units for bicycle paths and pedestrian paths, and rehabilitation of children’s play areas","General Administration of Jubail Project","Contracts and Procurement Department - Purchasing Department","800","2025-10-22","2025-11-20",3,"2025-11-23 @ 10:00",6,"lighting","https://tenders.etimad.sa/Tender/DetailsForVisitor?STenderId=Bx6p34Lv%20raCjCZiGMYhWA==","تأهيل وحدات انارة ممشى الدراجات وممرات المشاة وتأهيل مناطق العاب الأطفال","انارة"
"Improving and rehabilitating the intersections of Prince Mohammed bin Abdulaziz Road in Al-Aflaj","Riyadh Municipality","Aflaj Governorate Municipality","2000","2025-11-06","2025-11-24",7,"2025-11-26 @ 09:59",9,"junction","https://tenders.etimad.sa/Tender/DetailsForVisitor?STenderId=4*@@**Yk1AZZa8ckfmfjwd6ijA==","تحسين وتأهيل تقاطعات طريق الأمير محمد بن عبدالعزيز بالأفلاج","تقاطع"