"Framework agreement for government travel for newly emerging airlines","Authority for Efficiency of Expenditure and Government Projects","Spending Efficiency Achievement Center","500","2025-11-28",21,"2025-12-16",-2,"2025-12-18 @ 20:00",0,"platform","https://tenders.etimad.sa/Tender/DetailsForVisitor?STenderId=KtyfYGArh%20oot0cVLh*@@**J3g==","الاتفاقية الإطارية للسفر الحكومي لشركات الطيران الناشئة حديثاً","منصة"
"A project to renew Service Now licenses for the internal services platform","Ministry of Human Resources and Social Development","Purchasing management","600","2025-11-19",32,"2025-12-09",-9,"2025-12-20 @ 09:59",2,"platform","https://tenders.etimad.sa/Tender/DetailsForVisitor?STenderId=TeAYIwyET6a3TR%203a3vHIg==","مشروع تجديد رخص سيرفس ناو لمنصة خدماتي الداخلية","منصة"
"Operation and technical support for the digital platform for investing in media materials","Radio and Television Corporation","Financial management - purchasing","1000","2025-11-18",34,"2025-11-28",-20,"2025-12-21 @ 09:59",3,"platform","https://tenders.etimad.sa/Tender/DetailsForVisitor?STenderId=zRFP9U7WwtvrpyjmJ8fPbw==","تشغيل ودعم فني للمنصة الرقمية لاستثمار المواد الاعلامية","منصة"
"Developing the first phase of the digital diplomatic center","Ministry of Foreign Affairs","General Office - Purchases","1000","2025-11-13",46,"2025-12-16",-2,"2025-12-28 @ 12:00",10,"platform","https://tenders.etimad.sa/Tender/DetailsForVisitor?STenderId=6xiFOEos89r8b%20W2AQCR1w==","تطوير المرحلة الأولى من المركز الدبلوماسي الرقمي","منصة"
"Providing and installing secure communication requirements (Brouk platform) at the General Ports Authority","General Corporation for Ports","Purchasing and contracts management","800","2025-11-04",51,"2025-12-09",-9,"2025-12-24 @ 09:00",6,"platform","https://tenders.etimad.sa/Tender/DetailsForVisitor?STenderId=krTXcaJV0VQoF*@@**lQAPvgIA==","توفير وتركيب متطلبات الاتصال الآمن (منصة بروق) بالهيئة العامة للموانئ","منصة"
"Supply of spare parts for His Majesty the King’s ships (Maritime Supply Center in the Eastern Fleet)","Navy","Marine Supply Center in the Eastern Fleet","200","2025-12-17",7,"2025-12-21",3,"2025-12-23 @ 09:59",5,"fleet","https://tenders.etimad.sa/Tender/DetailsForVisitor?STenderId=VaYNK6UpBNUyjVXJXr70ew==","توريد قطع غيار سفن جلالة الملك (مركز التموين البحري بالاسطول الشرقي )","اسطول"
"Renting a Taurus car to the Eastern Fleet Marine Supply Center","Navy","Marine Supply Center in the Eastern Fleet","200","2025-12-15",5,"2025-12-16",-2,"2025-12-19 @ 09:59",1,"fleet","https://tenders.etimad.sa/Tender/DetailsForVisitor?STenderId=mtOtQxvm579PploHQ1qq*@@**w==","استئجار سيارة تورس لمركز التموين البحري بالاسطول الشرقي","اسطول"
"An asphalt, sidewalks and lighting project in the city of Qaisumah","Qaisumah Municipality","Hafr Al-Batin Governorate Municipality - Qaisumah Municipality","6000","2025-12-18",17,"2025-12-23",5,"2026-01-03 @ 09:59",16,"lighting","https://tenders.etimad.sa/Tender/DetailsForVisitor?STenderId=hYftmRnk173e8Lkj42WxFg==","مشروع سفلتة وأرصفة وانارة في مدينة القيصومة","انارة"
"Maintenance of streets, sidewalks, and lighting in Hotat Sudair and its affiliated centers","Riyadh Municipality","Hotat Sudair Municipality","1000","2025-12-16",23,"2025-12-26",8,"2026-01-07 @ 09:59",20,"lighting","https://tenders.etimad.sa/Tender/DetailsForVisitor?STenderId=VTtlT2MCCZI14GmudrritQ==","اعمال صيانة الشوارع والارصفة والانارة بحوطة سدير والمراكز التابعه لها","انارة"
"Infrastructure maintenance project for lighting works on transportation roads received from the Ministry of Transport - King Saud Road (straw...","Eastern Province Secretariat","Purchasing management for public competitions for the Eastern Province Secretariat","1500","2025-12-08",17,"2025-12-18",0,"2025-12-24 @ 09:59",6,"lighting","https://tenders.etimad.sa/Tender/DetailsForVisitor?STenderId=7YFuFQ70LICKW01dAGEYYw==","مشروع صيانة البنية التحتية لأعمال الانارة لطرق النقل المستلمة من وزارة النقل ـ طريق الملك سعود (القش ...","انارة"
"Infrastructure maintenance project for lighting works on transportation roads received from the Ministry of Transport - King Saud Road (straw...","Eastern Province Secretariat","Purchasing management for public competitions for the Eastern Province Secretariat","1500","2025-12-04",18,"2025-12-14",-4,"2025-12-21 @ 09:59",3,"lighting","https://tenders.etimad.sa/Tender/DetailsForVisitor?STenderId=xSB4Sb%20AteWvgKYIGkKAIA==","مشروع صيانة البنية التحتية لأعمال الانارة لطرق النقل المستلمة من وزارة النقل ـ طريق الملك سعود (القش ...","انارة"
"Supplying lighting for the Jubail production system 60019082, East Coast","Saudi Water Authority","East Coast Purchasing Division","500","2025-11-30",27,"2025-12-10",-8,"2025-12-26 @ 09:59",8,"lighting","https://tenders.etimad.sa/Tender/DetailsForVisitor?STenderId=JwZEZF*@@**1X61jREaPgHqzIQ==","توريد انارة لمنظومة انتاج الجبيل 60019082 الساحل الشرقي","انارة"
"Supplying lighting for the Ras Al-Khair production system, 60019062, East Coast","Saudi Water Authority","East Coast Purchasing Division","200","2025-11-25",32,"2025-12-05",-13,"2025-12-26 @ 09:59",8,"lighting","https://tenders.etimad.sa/Tender/DetailsForVisitor?STenderId=ZVcZcI7Uti%20eKvDf%20FFq1g==","توريد انارة لمنظومة انتاج رأس الخير 60019062 الساحل الشرقي","انارة"
"Emergency maintenance project to repair the Abu Bakr Al-Siddiq Road Bridge, King Abdullah Road intersection DA 8","Eastern Province Secretariat","Purchasing management for public competitions for the Eastern Province Secretariat","1500","2025-12-15",18,"2025-12-20",2,"2026-01-01 @ 09:59",14,"intersection","https://tenders.etimad.sa/Tender/DetailsForVisitor?STenderId=8bN6ayLg1VfCyUMMjxeAMg==","مشروع الصيانة الطارئة لإصلاح جسر طريق أبوبكر الصديق تقاطع طريق الملك عبد الله DA 8","تقاطع"
"Maintaining dilapidated parts of the asphalt layer of roads intersecting with King Abdulaziz Road","Riyadh Municipality","Al-Rain Governorate Municipality","2500","2025-12-14",19,"2025-12-28",10,"2026-01-01 @ 10:00",14,"intersection","https://tenders.etimad.sa/Tender/DetailsForVisitor?STenderId=pEDPV9tpyY%20XdTzcTJvyEQ==","صيانة الأجزاء المتهالكة من الطبقة الإسفلتية للطرق المتقاطعة مع طريق الملك عبدالعزيز","تقاطع"